name,title,url,email,ed,bio,cvlink,interests,publicationsPanos Kouvelis,Director of The Boeing Center for Supply Chain Innovation and Emerson Distinguished Professor of Operations and Manufacturing Management,https://olin.wustl.edu/EN-US/Faculty-Research/Faculty/Pages/FacultyDetail.aspx?username=kouvelis,kouvelis@wustl.edu,"PhD 1988, Stanford University
MBA 1985, University of Southern California
MS 1985, University of Southern California
BS 1983, National Technical University of Athens","Prior to joining Olin, Panos Kouvelis served as an associate professor at the Fuqua School of Business at Duke University and as an assistant professor at the University of Texas at Austin. He has published three books and over 80 papers in top-quality academic journals. Kouvelis has held visiting appointments with the Graduate School of Business, University of Chicago, where he taught in the executive programs in Barcelona, Chicago and Singapore, WHU- Koblenz School of Management, Germany, and Singapore Management University, Singapore. He has consulted with and/or taught executive programs for Emerson, IBM, Dell Computers, Boeing, Hanes, Duke Hospital, Solutia, Express Scripts, Spartech, MEMC, Ingram Micro, Smurfit Stone, Reckitt & Colman, and Bunge on supply chain, operations strategy, inventory management, lean manufacturing, operations scheduling and manufacturing system design issues.",http://apps.olin.wustl.edu/faculty/kouvelis/CV.pdf,"Global supply chain management, operations and finance interfaces, risk management in supply chains, commodity risk management, operations strategy, managing the innovation process, marketing/manufacturing interfaces, product line design, lean manufacturing, inventory control, operations planning, project management, cyclic scheduling, manufacturing system design, management science and optimization.","""Adoption of cost reducing technology by asymmetric duopolists in a stochastically evolving market"", IIE Trans, Issue 2, 145-157, with C. Chambers, P. Su, 2009","""Flexible Backup Supply and the Management of Lead Time Uncertainty"", Prod Oper Manag, Issue 2, 184-199, with J. Li, 2008","""Global Facility Network Design with Responsive Pricing"", Manuf Serv Oper Manage, Issue 2, 278-298, with L. Dong, P. Su, 2010","""Supplier behavior and the effectiveness of coordinating contracts"", Management Science, with J. Niederhoff, 2011","""Sourcing decisions in the presence of yield and demand uncertainty""(Working Paper), with J. Li, 2011","""Inventory management & financial hedging of storable commodities"", Manufacturing Service Operations Management, with R. Li, Q. Ding, 2011","""Market-based supply chain coordination by matching suppliers cost structures with buyers' order profiles"", Management Sci, Issue 11, 1861-1875, with Y. Xia, B. Chen, 2008"
Durai Sundaramoorthi,Senior Lecturer in Management,https://olin.wustl.edu/EN-US/Faculty-Research/Faculty/Pages/FacultyDetail.aspx?username=sundaramoorthi,sundaramoorthi@wustl.edu,"PhD 2007, The University of Texas at Arlington
MS 2002, The University of Texas at Arlington
BS 1999, Bharathiar University","Dr. Durai Sundaramoorthi received his PhD in Industrial Engineering (Operations Research) from the University of Texas at Arlington. He performed his doctoral research in the Center on Stochastic Modeling, Optimization, and Statistics (COSMOS). He also has a M.S. in Industrial Engineering from the University of Texas at Arlington and a B.S. in Mechanical Engineering from Bharathiar University, India. Prior to this position, Dr. Sundaramoorthi held fulltime faculty positions at University of Missouri-Rolla and Missouri Western State University. Dr. Durai's research interests include Business Analytics, Data Mining, Optimization, Simulation, and Simulation-based Optimization applied to diverse applications. In a collaborative research with nursing and engineering faculty members, and health care professionals from hospitals, he developed a novel data-driven simulation-based analytics approach using tree-based data mining methods to optimize nurse-to-patient assignments based on Big Data from Baylor Regional Medical Center, Grapevine, TX. This research was a pioneering attempt in using Big Data for Business Analytics and Intelligence. The methodology was well received by the research community and was funded by Robert Wood Johnson foundation. The success of this research has paved way to the development of data-driven simulation-based models for the prediction of Standard & Poor 500 and forecasting of ground-level ozone concentration. The Standard & Poor 500 simulation reduces the risk involved in the weekly investments while the ground-level ozone-concentration simulation model can help the policy makers understand the dynamics of ground-level ozone. Apart from academic research, he has worked on process improvement projects at Heartland Regional Medical Center, Baylor Regional Medical Center, FedEx, GE, and Thomas & Betts that utilized data mining, simulation, optimization, and financial modeling.",nocv,"Methodology: Business Analytics, Data Mining, Simulation, and Simulation-based Optimization.","""A Data-Integrated Simulation Model to Forecast Ground-Level Ozone Concentration"", Annals of Operations Research, Issue 1, 53 - 69, 2014","""Determining Playing Eleven of a Cricket Team"", International Journal of Operations Research and Information Systems, Issue 4, 57 - 74, 2015","""A Data-Integrated Simulation of Financial Market Dynamics"", International Journal of Operations Research and Information Systems, 74 - 86, with A. Coult, D. Nguyen, 2012","""Simulation and patient assignment: Unearthing patterns"", Nursing Management, Issue 11, 14-16, with J. Rosenberger, V. Chen, D. Behan, S. Kim, 2010","""A Data-Integrated Simulation-Based Optimization for Assigning Nurses to Patient Admissions"", Health Care Management Science, Issue 3, 210-221, with V. Chen, J. Rosenberger, S. Kim, D. Behan, 2010","""A Data-Integrated Simulation Model to Evaluate Nurse-Patient Assignments"", Health Care Management Science, Issue 3, 252-268, with V. Chen, J. Rosenberger, S. Kim, D. Behan, 2009"
Michelle Duguid,Associate Professor of Organizational Behavior,https://olin.wustl.edu/EN-US/Faculty-Research/Faculty/Pages/FacultyDetail.aspx?username=duguid,duguid@wustl.edu,"PhD 2008, Cornell University
MS 2005, Cornell University","Michelle Duguid joined the Olin faculty in 2009. She received her Ph.D. from Cornell University. She has two major research streams: (i) group demography and social status and (ii) group creativity and decision-making. The first line of work focuses on how group demography and status differences among group members shape individuals perceptions, interactions and behaviors and group relations. Her other area of research investigates group creativity and the quality of group decision-making.",nocv,"Social Status & Group Dynamics, Group Creativity & Decision Making, Demographic Effects on Inter- & Intra-group Relations, Social Categorization","""Creativity from Constraint? How Political Correctness Influences Creativity in Mixed-Sex Work Groups"", Administrative Science Quarterly, with J. Goncalo, J. Chatman, J. Kennedy","""Squeezed In the Middle: The Middle Status Trade Creativity for Focus"", Journal of Personality and Social Psychology, with J. Goncalo, 2015","""Follow the Crowd in a New Direction: When Conformity Pressure Facilitates Group Creativity (And When It Does Not)"", Organizational Behavior and Human Decision Processes, with J. Goncalo, 2012","""Living Large: The Powerful Overestimate Their Own Height"", Psychological Science, 36-40, with J. Goncalo, 2012","""Female Tokens in High-Prestige Work Groups: Catalysts or Inhibitors of Group Diversification?"", Organizational Behavior and Human Decision Processes, 104-115, 2011","""The Impact of Categorical Status, Numeric Representation and Work Group Prestige on Preference for Demographically Similar Others: A Value Threat Approach"", Organization Science, with D. Loyd, P. Tolbert","""Hidden Consequences of the Group Serving Bias: Causal Attributions and the Quality of Group Decision Making"", Organizational Behavior and Human Decision Processes, 219-233, with J. Goncalo, 2008"
Ivan Lapuka,Lecturer in Marketing,https://olin.wustl.edu/EN-US/Faculty-Research/Faculty/Pages/FacultyDetail.aspx?username=ilapuka,ilapuka@wustl.edu,,,nocv,noint
Mark Taylor,Dean of the Olin Business School and Professor of Finance,https://olin.wustl.edu/EN-US/Faculty-Research/Faculty/Pages/FacultyDetail.aspx?username=mark.p.taylor,mark.p.taylor@wustl.edu,"DSc (Higher Doctorate, awarded for lifetime distinguished contributions) 2012, University of Warwick
MBA 2010, Institute of Education, University College, London (part-time)
MA 2001, University of Liverpool
MA 1984, St. John's College, University of Oxford
PhD 1984, Birbeck College, University of London
1982, Birbeck College, University of London
BA 1980, St. John's College, University of Oxford",,nocv,Economics and Finance: Financial markets; international finance; international macroeconomics; macroeconomics Higher Education Management: University governance; entrepreneurialism; university finance; interdisciplinary English Literature: Shakespeare in performance; stage history
Catherine Dunkin,Lecturer in Business Communications,https://olin.wustl.edu/EN-US/Faculty-Research/Faculty/Pages/FacultyDetail.aspx?username=cdunkin,cdunkin@wustl.edu,"Bachelor of Journalism 1980,",,nocv,noint
Mark Leary,Associate Professor of Finance,https://olin.wustl.edu/EN-US/Faculty-Research/Faculty/Pages/FacultyDetail.aspx?username=leary,leary@wustl.edu,"PhD 2006, Duke University
MBA 1998, New York University, Stern School of Business
BA 1994, Rutgers University","Professor Leary joined Olin in 2010. He taught previously at Cornell University and, prior to his academic career, worked for CVS Corp. and the Federal Reserve Bank of NY. Leary's research investigates the motives behind corporate financial policy decisions, including leverage, security issuance, dividend and share repurchase decisions. His work has demonstrated the roles of adjustment costs, credit conditions, and peer firms in affecting financial policy.",http://apps.olin.wustl.edu/faculty/leary/CV.pdf,"Empirical corporate finance - capital structure, payout policy, security issuance and financial intermediaries","""Do Peer Firms Affect Corporate Financial Policy?"", Journal of Finance, Issue 1, 139-178, with M. Roberts, 2014","""Why Firms Smooth Dividends: Empirical Evidence"", Review of Financial Studies, with R. Michaely, 2011","""The Pecking Order, Debt Capacity, and Information Asymmetry"", Journal of Financial Economics, with M. Roberts, 2010","""Bank Loan Supply, Lender Choice, and Corporate Capital Structure"", Journal of Finance, 2009","""Do Firms Rebalance their Capital Structures?"", Journal of Finance, with M. Roberts, 2005"
Anjan Thakor,Director of Doctoral Programs & CFAR and John E. Simon Professor of Finance,https://olin.wustl.edu/EN-US/Faculty-Research/Faculty/Pages/FacultyDetail.aspx?username=thakor,thakor@wustl.edu,"PhD 1979, Northwestern University","Prior to joining the Olin Business School, Thakor was The Edward J. Frey Professor of Banking and Finance at the Ross School of Business, University of Michigan, where he also served as chairman of the Finance area. He has served on the faculties of Indiana University, Northwestern University, and UCLA. He has worked with many companies, including Whirlpool Corporation, Allison Engine Co., Citigroup, RR Donnelley, Dana Corporation, Anheuser-Busch, Zenith Corporation, Lincoln National Corporation, J.P. Morgan, Landscape Structures, Inc., CIGNA, Borg-Warner Automotive, Waxman Industries, Reuters, The Limited, Ryder Integrated Logistics, AT&T, CH2M Hill, Takata Corporation, Tyson Foods, Spartech, and Bunge. He also served as an expert witness in many federal cases involving banking litigation.",http://apps.olin.wustl.edu/faculty/Thakor/CV.pdf,"Corporate finance, financial intermediation and economics of asymmetric information.","""Financial System Development and Political Intervention"", World Bank Economic Review, Issue 26-1, with F. Song, 2012","""Robust Capital Regulation"", Federal Reserve Bank of New York Current Issues in Economics and Finance, Issue 18-3, with V. Acharya, H. Mehran, T. Schuermann, 2012","""Incentives to Innovate and Financial Crises"", Journal of Financial Economics, Issue 103-1, 130-148, 2012","""Managerial Autonomy, Allocation of Control Rights, and Optimal Capital Structure"", Review of Financial Studies, Issue 10, 3434-3485, with A. Boot, 2011","""Financial System Architecture and the Co-evolution of Banks and Markets"", The Economic Journal, Issue 547, 1021-1255, with F. Song, 2010","""Overconfidence, Leadership Selection, and Corporate Governance"", Journal of Finance, Issue 6, 2737-2784, with A. Goel, 2008","""Why Do Firms Issue Equity?"", Journal of Finance, Issue 1, 1-54, with A. Dittmar, 2007","""The Entrepreneur's Choice Between Private and Public Ownership"", Journal of Finance, Issue 2, 803-836, with A. Boot, R. Gopalan, 2006"
Philip Dybvig,Boatmen's Bancshares Professor of Banking and Finance,https://olin.wustl.edu/EN-US/Faculty-Research/Faculty/Pages/FacultyDetail.aspx?username=dybvig,DYBVIG@WUSTL.EDU,"PhD 1979, Yale University
MA 1978, Yale University
BA 1976, Indiana University","Philip H. Dybvig is well known for his paper, Diamond-Dybvig [1983], one of the most widely cited papers in Finance and Economics. The Diamond-Dybvig model shows how banks serve the economy by creating liquidity, and how this liquidity creation subjects the banks to runs if there is not any deposit insurance or other protection. Dybvig previously taught at Princeton University and was tenured at Yale University. He has published two textbooks and more than 35 articles in leading journals. He has consulted for government, organizations, and individuals.",http://apps.olin.wustl.edu/faculty/Dybvig/CV.pdf,"Banking, corporate finance, financial markets, asset pricing, fixed-income securities, industrial organization, porfolio management","""Consensus on Diverse Corporate Boards"", Review of Financial Studies, 715-747, with N. Baranchuk, 2009","""The Fallacy of Large Numbers, and a Defense of Diversified Active Managers"", Journal of Applied Finance, 2005","""Employee Reload Options: Pricing, Hedging, and Optimal Exercise"", Review of Financial Studies, Issue 145-171, with M. Loewenstein, 2003","""Pricing Long Bonds: Pitfalls & Opportunities"", Financial Analysts Journal, 32-39, 1996","""Duesenberry's Ratcheting of Consumption: Optimal Dynamic Consumption and Investment Given Intolerance for any Decline in Standard of Living"", Review of Economic Studies, 287-313, 1995","""Inefficient Dynamic Portfolio Strategies, or How to Throw Away a Million Dollars in the Stock Market"", Review of Financial Studies, 67-88, 1988","""Bank Runs, Deposit Insurance, and Liquidity"", Journal of Political Economy, 401-419, 1983"
Robyn LeBoeuf,Associate Professor of Marketing,https://olin.wustl.edu/EN-US/Faculty-Research/Faculty/Pages/FacultyDetail.aspx?username=leboeuf,leboeuf@WUSTL.EDU,"PhD 2002, Princeton University
MA 1999, Princeton University
BA 1997, American University","Robyn LeBoeuf earned her PhD in psychology at Princeton University. Much of her research has examined how people’s choices, judgments, and behaviors can be biased by incidental factors, like question wording. Her recent projects have investigated how people plan for, and make decisions about, the future, and how people make decisions when giving gifts. She has published articles in a wide variety of psychology and marketing journals, and she was the 2002 recipient of the Hillel Einhorn New Investigator Award.",http://apps.olin.wustl.edu/faculty/leboeuf/CV.pdf,"Consumer Behavior, Judgment and Decision Making, Behavioral Decision Theory, Intertemporal Choice, Gift Giving","""Forceful phantom firsts: Framing experiences as firsts amplifies their influence on judgment"", Journal of Marketing Research, Issue 51(4), 420-432, with E. Williams, L. Brenner, 2014","""Over-individuation in gift giving: Shopping for multiple recipients leads givers to choose unique but less preferred gifts"", Journal of Consumer Research, Issue 40(6), 1167-1180, with M. Steffel, 2014","""Consequence-cause matching: Looking to the consequences of events to infer their causes"", Journal of Consumer Research, Issue 39(1), 128-141, with M. Norton, 2012","""Correcting the past: Failures to replicate psi"", Journal of Personality and Social Psychology, Issue 103(6), 933-948, with J. Galak, L. Nelson, J. Simmons, 2012","""Branding alters attitude functions and reduces the advantage of function-matching persuasive appeals"", Journal of Marketing Research, Issue 47(2), 348-360, with J. Simmons, 2010","""Letting good opportunities pass us by: Examining the role of mindset during goal pursuit"", Journal of Consumer Research, Issue 37(4), 570-583, with J. Bayuk, C. Janiszewski, 2010","""Looming losses in future time perception"", Journal of Marketing Research, Issue 47(3), 520-530, with B. Bilgin, 2010","""The conflicting choices of alternating selves"", Organizational Behavior and Human Decision Process, Issue 111(1), 48-61, with E. Shafir, J. Bayuk, 2010","""The effect of accuracy motivation on anchoring and adjustment: Do people adjust from provided anchors?"", Journal of Personality and Social Psychology, Issue 99(2), 917-932, with J. Simmons, L. Nelson, 2010","""Anchoring on the ""here"" and ""now"" in time and distance judgments"", Journal of Experimental Psychology: Learning, Memory, and Cognition, Issue 35(1), 81-93, with E. Shafir, 2009"
Raphael Thomadsen,Associate Professor of Marketing,https://olin.wustl.edu/EN-US/Faculty-Research/Faculty/Pages/FacultyDetail.aspx?username=thomadsen,thomadsen@wustl.edu,"PhD 2001, Stanford University
1996, Stanford University
BA 1994, University of Wisconsin",,http://apps.olin.wustl.edu/faculty/thomadsen/CV.pdf,"Pricing, Product Design, Game Theory, Point-of-Sale, Marketing","""A Reflection on Analytical Work in Marketing: Three Points of Consensus"", Marketing Letters, Issue 2, 381-389, with R. Zeithammer, D. Mayzlin, Y. Orhun, A. Pazgal, D. Purohit, R. Rao, M. Riordan, J. Shin, M. Sun, M. Villas-Boas, 2012","""Profit-Increasing Consumer Exit"", Marketing Science, Issue 32(6), 998-1008, with A. Pazgal, D. Soberman, 2013","""You Can Benefit from a Rival's New Product"", Harvard Business Review, p. 24, 2013","""Vertical Differentiation with Variety-Seeking Customers"", Management Science, Issue 59(2), 390-401, with R. Zeithammer, 2012","""Seeking an Expanding Competitor: How Product Line Expansion Can Increase All Firms' Profits"", Journal of Marketing Research, Issue 49(3), 349-360, 2012","""Cooperation in Games and Forgetfulness"", Management Science, Issue 57(2), 363-375, with P. Bhardwaj, 2011","""Competition and Price Discrimination in the Market for Mailing Lists"", Quantitative Marketing and Economics, Issue 7(2), 147-179, with R. Borzekowski, C. Taragin, 2009","""Product Positioning and Competition: The Role of Location in the Fast Food Industry"", Marketing Science, Issue 26(6), 2007","""The Effect of Ownership Structure on Prices in Geographically Differentiated Industries"", RAND Journal of Economics, Issue 36(4), 908-929, 2005"
Daniel Elfenbein,Associate Professor of Strategy,https://olin.wustl.edu/EN-US/Faculty-Research/Faculty/Pages/FacultyDetail.aspx?username=elfenbein,elfenbein@wustl.edu,"PhD 2004, Harvard University
MA 2001, Harvard University
BA 1994, Harvard University","Prior to joining the Olin Business School, Elfenbein taught in the MBA program at the University of California - Berkeley. He has also worked as an economist for the President's Council of Economic Advisers and as a management consultant for the Monitor Group. Elfenbein is a member of the Academy of Management and American Economic Association and serves as a referee for numerous academic journals. In addition to his many research interests, Elfenbein has studied the economics of NFL ticket scalping on-line.",nocv,Governance of complex transactions; markets for intellectual property; innovation and technological change; university-industry technology transfer; incentives in organizations,"""Equity Stakes and Exit: An Experimental Approach to Decomposing Exit Delays"", Strategic Management Journal, with A. Knott, R. Croson","""Time to Exit: Rational, Behavioral and Organizational Delays"", Strategic Management Journal, Issue 7, 957-1114, with A. Knott, 2015","""Charity as a Substitute for Reputation: Evidence from an Online Marketplace"", Review of Economic Studies, Issue 4, 1441-1468, with R. Fisman, B. McManus, 2012","""The Small Firm Effect and the Entrepreneurial Spawning of Scientists and Engineers"", Management Science, Issue 4, 659-681, with B. Hamilton, T. Zenger, 2010","""A Greater Price for a Greater Good? Evidence that Consumers Pay More for Charity-Linked Products"", American Economic Journal: Economic Policy, Issue 2, 28-60, with B. McManus, 2010","""Publications, Patents, and the Market for University Inventions"", Journal of Economic Behavior and Organization, Issue 4, 688-715, 2007","""Ownership and Control Rights in Internet Portal Alliances, 1995-1999"", RAND Journal of Economics, Issue 2, 356-69, with J. Lerner, 2003","""What is a Relationship Worth? Repeated Exchange and the Development of Relational Capital"", Organization Science, Issue 1, 222-244, with T. Zenger, 2014"
Jeongmin (Mina) Lee,Assistant Professor of Finance,https://olin.wustl.edu/EN-US/Faculty-Research/Faculty/Pages/FacultyDetail.aspx?username=jlee89,JLee89@WUSTL.EDU,"PhD 2014, University of Maryland
MS 2008, Korea Advanced Institute of Science and Technology
BS 2005, Pohang University of Science and Technology",,nocv,"Financial Institutions, Market Microstructure, Information Economics."
Staci Thomas,Lecturer in Communication,https://olin.wustl.edu/EN-US/Faculty-Research/Faculty/Pages/FacultyDetail.aspx?username=staci_thomas,staci_thomas@wustl.edu,"MA 2010, Webster University
BA 1999, University of Missouri - St. Louis","Staci Thomas has over 15 years' experience in consumer and industrial product marketing communication. She began her career as a Mandarin translator for the US Air Force, working to lower cultural barriers and increase communication effectiveness. She then led communication initiatives at MagneTek Electric Motors, Sigma-Aldrich, Emerson Electric, Life Technologies and more. Staci has been teaching at Wash U for five years, most recently serving as the Assistant Director of English Language Programs. Her focus is providing an engaging, challenging environment that offers students relevant, real-world communication experience.",nocv,noint
Hillary Anger Elfenbein,Professor of Organizational Behavior,https://olin.wustl.edu/EN-US/Faculty-Research/Faculty/Pages/FacultyDetail.aspx?username=helfenbein,helfenbein@wustl.edu,"PhD 2001, Harvard University
MA 1996, Harvard University
BA 1994, Harvard University","Prior to Olin Business School, Hillary Anger Elfenbein was an Assistant Professor at the University of California at Berkeley, and a Senior Researcher at the Harvard Business School. Before beginning work on her PhD in Organizational Behavior, Hillary worked at Monitor Company management consulting for two years, and spent half a year doing nonprofit work in India.",nocv,Emotions in the Workplace
Zawadi Lemayian,Assistant Professor of Accounting,https://olin.wustl.edu/EN-US/Faculty-Research/Faculty/Pages/FacultyDetail.aspx?username=lemayian,lemayian@wustl.edu,"PhD 2013, MIT
B.Sc. 2009, MIT
B.Sc. 2009, MIT","Zawadi Lemayian joined Olin Business School in 2013 after graduating from the Sloan School of Management at the Massachusetts Institute of Technology. Prior to her PhD, she was an undergraduate student at the Massachusetts Institute of Technology.",nocv,"Fixed income markets, Taxation, Banking, Disclosure","""Corporate Debt Repurchase and Earnings Management""(Working Paper)","""The Effect of Ordering on Information Acquisition Activities""(Working Paper), with R. Frankel, J. Jennings, Z. Kaplan","""How do Analysts Disseminate Information about Current Earnings to Investors?"", with Z. Kaplan"
Ngoc-Khanh Tran,Assistant Professor of Finance,https://olin.wustl.edu/EN-US/Faculty-Research/Faculty/Pages/FacultyDetail.aspx?username=ntran,ntran@wustl.edu,"PhD 2012, Massachusetts Institute of Technology
PhD 2005, University of Virginia
BS 1999, Uniwersytet Gdanski and Universite Paris Sud",,nocv,Asset Pricing and International Finance: visit my home page for downloadable papers,"""Growth Risk of Nontraded Industries and Asset Pricing"", working paper(Working Paper)","""Pricing Risks across Currency Denominations"", working paper(Working Paper), with T. Maurer, T. To","""Public Information and Risk Sharing in a Pure-Exchange Economy"", working paper(Working Paper), with T. Maurer","""Sequential Defaults in Banking Network"", working paper(Working Paper), with T. Vuong, R. Zeckhauser","""Specified Recovery"", working paper(Working Paper), with S. Xia","""The Behavior of Savings and Asset Prices When Preferences and Beliefs Are Heterogeneous"", working paper(Working Paper), with R. Zeckhauser","""The Functional Stochastic Discount Factor"", working paper(Working Paper)","""The Hirshleifer Effect in a Dynamic Setting"", working paper, with T. Maurer","""Optimal Factor Strategy in FX Markets"", working paper(Working Paper), with T. Maurer, T. To, 2016","""Entangled Risks in Incomplete FX Markets"", working paper, with T. Maurer"
