name,title,url,email,ed,bio,cvlink,interests,publications
Nicholas Argyres,Vernon W. & Marion K. Piper Professor of Strategy,https://olin.wustl.edu/EN-US/Faculty-Research/Faculty/Pages/FacultyDetail.aspx?username=argyres,argyres@wustl.edu,"PhD 1993, University of California Berkeley","Professor Argyres joined the Olin Business School faculty in 2008. He was previously Associate Professor at Boston University School of Management. Prior to that, he was Assistant Professor at the Marshall School of Business, University of Southern California. Professor Argyres' research is focused on topics in organizational strategy: organizational boundaries; contracting and inter-organizational relationships; internal organization structure; technology and organization; organizational dissent.",http://apps.olin.wustl.edu/faculty/argyres/CV.pdf,"Strategy and structure; vertical integration, contracting and inter-organizational arrangements; strategy and the institutional environment; information technology and organization; organizational politics","""Knowledge Inheritance, Vertical Integration, and Entrant Survival in the Early U.S. Auto Industry"", Academy of Management Journal (forthcoming), Issue 59, 1-19, with R. Mostafa","""Dominant Designs, Innovation Shocks and the Follower's Dilemma"", Strategic Management Journal, Issue 36, 216-234, with L. Bigelow, J. Nickerson, 2015","""Capabilities, Transaction Costs and Firm Boundaries"", Organization Science, Issue 23, 6, 1643-1657, with T. Zenger, 2012"
Tarek Ghani,Assistant Professor of Strategy,https://olin.wustl.edu/EN-US/Faculty-Research/Faculty/Pages/FacultyDetail.aspx?username=tghani,tghani@wustl.edu,"PhD 2015, Haas School of Business, UC Berkeley
MS 2012, Haas School of Business, UC Berkeley
BS 2004, Stanford University",Tarek Ghani's research explores the relationship between market development and institutional development in emerging economies.,http://drive.google.com/open?id=0B2zdXwAFImkSMWtjTW1IR2dIYm8,Financial and technological innovation in emerging economies; market power and institutional weakness.
David Meyer,Senior Lecturer in Management,https://olin.wustl.edu/EN-US/Faculty-Research/Faculty/Pages/FacultyDetail.aspx?username=dmeyer24,dmeyer24@wustl.edu,"PhD 1970, University of Chicago
MS 1967, Southern Illinois University
BA 1965, Concordia Teachers College","Before joining Olin, Meyer was a Professor of Sociology at Brown University.",http://apps.olin.wustl.edu/faculty/meyerd/CV.pdf,"Financial networks, Asian financial networks, Chinese business networks, Asian business centers","""Private Wealth Management in Asia"", Handbook of Asian Finance: Financial Markets and Sovereign Wealth Funds, 17-36, 2014","""The Banking Networks of Asian Financial Centers"", Handbook of Asian Finance: Financial Markets and Sovereign Wealth Funds, 37-52, 2014","""Challenges of Network Governance at the State Banks of China"", Journal of Contemporary China, Issue 75, 481-498, with T. Levy, 2012","""Small-World Job Mobility Integrates Hong Kong with Global Financial Centers"", Asian Geographer, Issue 1, 51-63, 2011","""Hong Kong's Transformation as a Financial Centre"", Hong Kong SAR's Monetary and Exchange Rate Challenges: Historical Perspectives, 161-88, 2009","""Structural Changes in the Economy of Hong Kong since 1997"", China Review, Issue 1, 7-29, 2008"
Deniz Aydin,Assistant Professor of Finance,https://olin.wustl.edu/EN-US/Faculty-Research/Faculty/Pages/FacultyDetail.aspx?username=daydin,daydin@wustl.edu,"Ph.D. 2016, Stanford
M.Sc. 2009, London School of Economics","Deniz Aydın is an Assistant Professor of Finance at Olin Business School. He joined Olin in July 2016 after earning his PhD in Economics from Stanford. A native of Istanbul, he holds a BA in economics and mathematics, with high honors, from Sabancı University, and a MSc in finance and economics from the London School of Economics. Before Olin, he worked as a Research Associate at Harvard Business School and an Associate Intern at Analysis Group.",http://dl.dropboxusercontent.com/u/4288327/DAydin_Vita.pdf,"Professor Aydın's research focus is on finance, empirical macroeconomics and applied microeconomics. His primary agenda studies the linkages between the financial sector and the real economy, within the context of household finance and corporate finance. He is also interested in behavioral economics, within the context of organizations and decision making."
Armando Gomes,Associate Professor of Finance,https://olin.wustl.edu/EN-US/Faculty-Research/Faculty/Pages/FacultyDetail.aspx?username=gomes,gomes@wustl.edu,"PhD 1997, Harvard University
MA 1992, Harvard University
MA 1990, Instituto de Matematica Pura e Aplicada-IMPA
BS 1988, Instituto Militar de Engenharia-IME","Professor Gomes' research program focuses on addressing questions in corporate finance and economics, applying game theory and economic tools to construct and evaluate models. Recurrent themes of his research are the study of asymmetric information and incentive problems and issues related to bargaining and contracting. His interest also lies in empirical research focusing on finance topics where synergies with theory are an important element in uncovering and understanding the questions.",nocv,"Corporate finance, mergers and acquisitions, corporate governance, economic theory","""Why Do Public Firms Issue Private and Public Securities?"", Review of Financial Studies, with G. Phillips, 2007","""SEC Regulation Fair Disclosure, Information, and the Cost of Capital"", Journal of Corporate Finance, 300-334, with G. Gorton, L. Madureira, 2007","""Dynamic Processes of Social & Economic Interactions: On the Persistence of Inefficiencies"", Journal of Political Economy, Issue 3, 626-667, with P. Jehiel, 2005","""Going Public without Governance: Managerial Reputation Effects"", Journal of Finance, Issue 2, 615-646, 2000","""Mergers & Acquisitions: An Experimental Analysis of Synergies, Externalities, and Dynamics"", Review of Finance, Issue 4, 481-514, with R. Crososn, K. McGinn, M. Noth, 2004","""Contracting with Externalities and Outside Options"", Journal of Economic Theory, with F. Bloch, 2005","""Multilateral Contracting with Externalities"", Econometrica, Issue 4, 1329-1350, 2005"
Todd Milbourn,"Senior Associate Dean of Programs, Faculty & Research and Hubert C. & Dorothy R. Moog Professor of Finance",https://olin.wustl.edu/EN-US/Faculty-Research/Faculty/Pages/FacultyDetail.aspx?username=milbourn,milbourn@wustl.edu,"PhD 1995, Indiana University
BA 1991, Augustana College",Professor Milbourn previously taught at the London Business School and the University of Chicago before coming to Olin.,http://apps.olin.wustl.edu/faculty/milbourn/CV.pdf,"Corporate finance, managerial career concerns, management compensation, and economics of asymmetric information","""Which Skills Matter in the Market for CEOs? Evidence from Pay for CEO Credentials"", Management Science, Issue 12, with A. Falato, D. Li, 2015","""CEO Equity Incentives and Financial Misreporting: The Role of Auditor Expertise"", The Accounting Review, Issue 2, 603-623, with S. Jayaraman, 2015","""How did increased competition affect credit ratings?"", Journal of Financial Economics(Working Paper), 493-514, with B. Becker, 2011","""Strategic Flexibility and the Optimality of Pay for Sector Performance"", Review of Financial Studies, Issue 5, 2060-2098, with R. Gopalan, F. Song, 2010","""Asymmetric Benchmarking in Compensation: Executives are Paid for Good Luck But Not Punished for Bad"", Journal of Financial Economics / Simon School of Business, Issue 1, 197-225, with G. Garvey, 2006","""Credit Ratings as Coordination Mechanisms"", Review of Financial Studies / Oxford University Press on behalf of The Society for Financial Studies, Issue 1, 81-118, with A. Boot, A. Schmeits, 2006","""Incentive Compensation When Executives Can Hedge the Market: Evidence of Relative Performance Evaluation in the Cross-Section"", Journal of Finance / American Finance Association, Issue 4, 1557-1582, with G. Garvey, 2003"
Mariagiovanna Baccara,Associate Professor of Economics,https://olin.wustl.edu/EN-US/Faculty-Research/Faculty/Pages/FacultyDetail.aspx?username=mbaccara,mbaccara@wustl.edu,"PhD 2003, Princeton University","Mariagiovanna Baccara joined the Olin Business School faculty in 2010. She was previously Assistant Professor at NYU Stern School of Business. Mariagiovanna's research is focused on Applied Microeconomics. In particular, she has been working in industrial organization, crime, matching, and social networks.",http://apps.olin.wustl.edu/faculty/Baccara/CV.pdf,"Innovation and intellectual property rights, organized crime, matching, and social networks.","""Homophily in Peer Groups"", American Economic Journal: Microeconomics, Issue 3, 69-96, with L. Yariv, 2013","""A Field Study of Matching with Network Externalities"", American Economic Review, with A. Imrohoroglu, A. Wilson, L. Yariv, 2012","""How to Organize Crime"", Review of Economic Studies, Issue 4, 1039-1067, with H. Bar-Isaac, 2008","""Bargaining on New Ideas: Rent Distribution and Stability of Innovative Firms"", Journal of European Economic Association, Issue 6, 1095-1129, with R. Razin, 2007","""Industry Size and the Distribution of R&D Investment"", International Journal of Industrial Organization, Issue 3, 254-270, with A. John, 2010","""Outsourcing Information Leakage and Consulting Firms"", RAND Journal of Economics, Issue 1, 269-289, 2007"
Arun Gopalakrishnan,Assistant Professor of Marketing,https://olin.wustl.edu/EN-US/Faculty-Research/Faculty/Pages/FacultyDetail.aspx?username=agopala,agopala@wustl.edu,"PhD 2015, University of Pennsylvania
MS 2012, University of Pennsylvania
MBA 2006, Penn State University
BE 2000, University of Auckland",,nocv,"Customer analytics, Bayesian analysis, Consumer risk and time preferences, Customer lifetime value, Digital marketing campaigns, R&D innovation","""A Cross-Cohort Changepoint Model for Customer-Base Analysis"", Marketing Science, with E. Bradlow, P. Fader","""Portfolio Management in New Drug Development"", Innovation and Marketing in Pharmaceutical Industry: Achieving Sustainable Success, 83-118, with M. Ding, S. Dong, J. Eliashberg, 2014","""Consumer Dynamic Usage Allocation and Learning under Multipart Tariffs"", Marketing Science, Issue 1, 116-133, with R. Iyengar, R. Meyer, 2015"
Melanie Milovac,Postdoctoral Research Associate,https://olin.wustl.edu/EN-US/Faculty-Research/Faculty/Pages/FacultyDetail.aspx?username=mmilovac,mmilovac@wustl.edu,"PhD 2016, University of Cambridge
BS 2010, Psychology, University of Heidelberg","Prior to joining Olin Business School, Melanie Milovac was a Predoctoral Fellow at Ross School of Business, University of Michigan. Milovac's research focuses broadly on how people evaluate entrepreneurs, entrepreneurial teams and their creative ideas for new businesses. Milovac has been invited to present this work at several conferences and universities. For more information, please visit Melanie Milovac's personal website at http:// melaniemilovac.com",nocv,"Impressions of Entrepreneurs, Implicit Theories, Affect","""Milovac, M. & Sanchez-Burks, J. (under review). Reading Emotional Tea Leaves: How Judges’ Implicit Theories about Entrepreneurs’ Affect Inform their Impressions of Nascent Entrepreneurs.""","""A successful entrepreneur is not a positive one: Negative affective cues enhance evaluation."", Academy of Management Proceedings (Vol. 2014, No. 1, p. 13086), with J. Sanchez-Burks, 2014"
Markus Baer,Associate Professor of Organizational Behavior,https://olin.wustl.edu/EN-US/Faculty-Research/Faculty/Pages/FacultyDetail.aspx?username=baer,baer@wustl.edu,"PhD 2007, University of Illinois at Urbana-Champaign
MA 2000, University of Giessen, Germany","Prior to earning his doctorate, Professor Baer worked in the German automotive industry and, as a member of the founding team of a university-affiliated start-up venture, consulted for firms in Europe and Asia. His expertise lies in the areas of creativity and innovation.",http://apps.olin.wustl.edu/faculty/Baer/CV.pdf,"The determinants of the various activities (i.e., problem formulation, idea generation, solution implementation) comprising creativity and innovation in organizations.","""Microfoundations of strategic problem formulation"", Strategic Management Journal, 197-214, with K. Dirks, J. Nickerson, T. Zenger, 2013","""Putting creativity to work: The implementation of creative ideas in organizations"", Academy of Management Journal, 55, 1102-1119, 2012","""Creative self-efficacy and creativity in the team context: Cross-level interactions with team informational resources"", Journal of Applied Psychology, 97, 1282-1290, with A. Richter, G. Hirst, D. Van Knippenberg, 2012","""Blind in one eye: How psychological ownership of ideas determines the types of suggestions people adopt"", Organizational Behavior and Human Decision Processes, 118, 60-71, with G. Brown, 2012","""Location in negotiation: Is there a home field advantage?"", Organizational Behavior and Human Decision Processes, 114, 190-200, with G. Brown, 2011","""The strength-of-weak-ties perspective on creativity: A comprehensive examination and extension"", Journal of Applied Psychology, 95, 592-601, 2010","""Win or lose the battle for creativity: The power and perils of intergroup competition"", Academy of Management Journal, 53, 827-845, with R. Leenders, G. Oldham, A. Vadera, 2010","""The curvilinear relation between experienced creative time pressure and creativity: Moderating effects of openness to experience and support for creativity"", Journal of Applied Psychology, 91, 963-970, with G. Oldham, 2006","""Innovation is not enough: Climates for initiative and psychological safety, process innovations, and firm performance"", Journal of Organizational Behavior, 24, 45-68, with M. Frese, 2003"
Radhakrishnan (Radha) Gopalan,Associate Professor of Finance,https://olin.wustl.edu/EN-US/Faculty-Research/Faculty/Pages/FacultyDetail.aspx?username=gopalan,gopalan@wustl.edu,"PhD 2006, University of Michigan
MBA 1996, Indian Institute of Management
B.E. 1994, Annamalai University","Professor Gopalan joined Olin in 2006 after graduating from the University of Michigan. Prior to his Ph.D., he worked for five years in the project finance department of a leading Indian bank. He researches issues in theoretical and empirical corporate finance. Specifically he examines questions related to a firm's choice between public and private ownership, the benefits of a business group structure in emerging economies and about firm-bank relationships and the syndicated loan market.",nocv,"Corporate finance - corporate governance, emerging market financial systems, mergers & acquisitions, corporate restructuring and entrepreneurial finance.","""Affiliated Firms and Financial Support: Evidence from Indian Business Groups"", Journal of Finance Economics, Issue 3, 759-795, with V. Nanda, A. Seru, 2007","""Internal capital markets and dividend policies: Evidence from business groups"", Review of Financial Studies, Issue 4, 1102-1142, with V. Nanda, A. Seru, 2015"
Chakravarthi Narasimhan,Philip L. Siteman Professor of Marketing,https://olin.wustl.edu/EN-US/Faculty-Research/Faculty/Pages/FacultyDetail.aspx?username=narasimhan,narasimhan@wustl.edu,,"Chakravarthi Narasimhan was an assistant and associate professor at the University of Chicago from 1981 to 1988. His principal research interest is in the economic analysis of marketing problems. He builds models, measurements and metrics to quantify firms and consumers responses to marketing strategies in competitive markets. Several of his papers have won the Best paper of the Year award or were finalists to. He was chosen Teacher of the Year by the M.B.A. Graduating Class of 1991. He has been recognized by the Graduate Students Senate for Excellence in Mentoring three times.",http://apps.olin.wustl.edu/faculty/narasimhan/CV.pdf,"His current research interests are in supply chain strategies especially under uncertainty, competitive strategies in information intensive environment (e-strategies), modeling customer profitability and choice modeling.","""Persuasive Advertising and Product Line Design""(Working Paper), with Y. Lin, 2006","""Salesforce Compensation: Revisiting and Extending the Agency-Theoretic Approach"", Quantitative Marketing and Economics, with A. Coughlan, S. Misra, 2005","""Information and Inventory in Distribution Channels"", Management Science, with G. Iyer, R. Niraj, 2007","""Vertical Information Sharing in Distribution Channels""(Working Paper), with R. Niraj"
Taylor Begley,Assistant Professor of Finance,https://olin.wustl.edu/EN-US/Faculty-Research/Faculty/Pages/FacultyDetail.aspx?username=tbegley,tbegley@wustl.edu,"PhD 2014, University of Michigan, Ross School of Business
MS 2009, University of Kentucky
BS 2005, University of Kentucky","Taylor Begley joined Olin in 2016 after two years on the faculty at London Business School. He earned his PhD from the University of Michigan in 2014. Prior to studying finance and economics, Taylor earned his BS and MS in Electrical Engineering from the University of Kentucky.",nocv,"My research primarily focuses on the empirical investigation of financial contracting models in the presence of asymmetric information. More specifically, I am interested in how information asymmetry between providers and users of capital can lead to distortions in managerial decision making and the role that security design can play in mitigating such frictions in corporate finance and securitization markets."
Michael Gordinier,Senior Lecturer in Management,https://olin.wustl.edu/EN-US/Faculty-Research/Faculty/Pages/FacultyDetail.aspx?username=gordinier,gordinier@wustl.edu,"MBA 1990, Washington University in St. Louis
PhD 1980, University of Wisconsin
MS 1977, University of Wisconsin
BA 1975, St. Louis University","Professor Gordinier has been a lecturer at the Olin School since 1990 and has taught graduate level physics at the University of Missouri-St. Louis. Dr. Gordinier's unique approach to quantitative business education and his financial/ estate planning consulting business reflect his training as a physicist where the use of quantitative techniques are stressed. He brings over 15 years of practical experience to the classroom with such diverse organizations as the Oak Ridge National Laboratory, McDonnell Douglas Corp., U.S. Dept. of Energy, and National Life Insurance Co.",nocv,"Statistics, management science, financial planning, investments, insurance","""Nuclear Fusion Power"", Elsevier Science Ltd. / Robert A. Meyers ed., 1987","""Creative Uses of Life Insurance in Estate Planning: Irrevocable & Charitable Remainder Trust"", with S. Laiderman, 1995","""Understanding the Investment Potential of Variable Universal Life"", with S. Laiderman, 1995"
Yulia Nevskaya,Assistant Professor of Marketing,https://olin.wustl.edu/EN-US/Faculty-Research/Faculty/Pages/FacultyDetail.aspx?username=yulia.nevskaya,yulia.nevskaya@wustl.edu,"PhD 2013, University of Rochester
MA 2002, University of Colorado
BS 2001, Kostroma State Technological University",,nocv,"Consumer tastes evolution and habit formation, Dynamic structural choice model, Rewards programs, Digital marketing"
Pratim Biswas,Professor in Business and Lucy & Stanley Lopata Professor,https://olin.wustl.edu/EN-US/Faculty-Research/Faculty/Pages/FacultyDetail.aspx?username=pbiswas,pbiswas@wustl.edu,,,nocv,noint
Todd Gormley,Associate Professor of Finance,https://olin.wustl.edu/EN-US/Faculty-Research/Faculty/Pages/FacultyDetail.aspx?username=gormley,lastname [@] wustl [dot] edu,"PhD 2006, Massachusetts Institute of Technology
BA 2001, Michigan State University",Todd Gormley originally joined Olin in 2006 before moving to The Wharton School in 2009. Todd returned to Olin in 2016. His research focuses on why managers sometimes fail to act in the best interest of shareholders and what governance arrangements mitigate these conflicts. His most recent research has analyzed the impact of passive institutional investors on both firms’ governance structures and the strategic choices of outside activists.,http://www.gormley.info/cv.html,"Corporate Governance, Empirical Methods, Risk, Banking, Development","""Do Firms Adjust Their Timely Loss Recognition in Response to Changes in the Banking Industry?"", Journal of Accounting Research, Issue 1, 159-196, with B. Kim, X. Martin, 2012","""Passive Investors, Not Passive Owners"", Journal of Financial Economics, Issue 1, 111-141, with I. Appel, D. Keim, 2016","""Standing on the Shoulders of Giants: The Effect of Passive Investors on Activism"", with I. Appeld, D. Keim, 2016","""Playing it Safe? Managerial Preferences, Risk, and Agency Conflicts"", Journal of Financial Economics, with D. Matsa, 2016","""Common Errors: How to (and Not to) Control for Unobserved Heterogeneity"", Review of Financial Studies, Issue 2, 617-661, with D. Matsa, 2014","""Growing Out of Trouble: Corporate Responses to Liability Risk"", Review of Financial Studies, Issue 8, 2781-2821, with D. Matsa, 2011","""Limited Participation and Consumption-Saving Puzzles: A Simple Explanation and the Role of Insurance"", Journal of Financial Economics, Issue 2, 331-344, with H. Liu, G. Zhou, 2010","""Costly Information, Entry, and Credit Access"", Journal of Economic Theory, 633-667, 2014","""CEO Compensation and Corporate Risk-Taking: Evidence from a Natural Experiment"", Journal of Accounting and Economics, Issue 2-3, 79-101, with D. Matsa, T. Milbourn, 2013","""Too Big to Fail? Government Policy vs. Investor Perceptions"", Review of Finance, 491-518, with S. Johnson, C. Rhee, 2015"
Jackson Nickerson,Frahm Family Professor of Organization & Strategy; Brookings Non-resident Senior Scholar in Government Studies; Associate Dean and Director of the Brookings Executive Education,https://olin.wustl.edu/EN-US/Faculty-Research/Faculty/Pages/FacultyDetail.aspx?username=nickerson,nickerson@wustl.edu,,"Jackson Nickerson is the Frahm Family Professor of Organization and Strategy at the Olin Business School at Washington University in St. Louis. He also is director of the Brookings Executive Education program and a nonresident senior fellow in Governance Studies at the Brookings Institution. His research, which can be found in the leading academic journals, has won numerous awards including twice winning the Olin Award Recognizing Research That Transforms Business. His research on pharmaceutical manufacturing, which has been discussed in Business Week, has led to tangible changes in the way the FDA oversees pharmaceutical manufacturing. Jackson teaches strategic management and leadership courses on innovation, organizational strategy, and critical and strategic thinking. His research focuses on leadership issues around why firms choose different organizational structures and the performance implications of these choices; with a special emphasis on knowledge, innovation, and problem formulation and solving. Through executive education and consulting activities, Jackson has engaged and impacted numerous organizations for industries including architecture and art, chemicals, education, finance, health care, and pharmaceuticals",http://apps.olin.wustl.edu/faculty/nickerson/CV.pdf,"Business strategy organization choice and performance, corporate survival, new institutional economics, intellectual capital management, management of innovation and technology.","""Regulator Heterogeneity & Endogenous Efforts to Close the Information Asymmetry Bap: Evidence from FDA Regulation"", Journal of Law & Economics, with J. Mayo, J. Macher","""Does Outsourcing Affect the Variability of Product Performance: Evidence from International Courier Services"", Organization Science, with C. Hsieh, G. Lazzarini","""Envy, Comparison Costs, and the Economic Theory of the Firm"", Strategic Management Journal, Issue 43, 1429-1450, with T. Zenger, 2008","""Interorganizational-trust: the Choice of Make, Buy, or Ally and the performance of Interorganizational Relationships in the U.S. Auto Industry"", Organization Science, Issue 5, 688-708, with R. Gulati, 2008","""The 'problem' of creating and capturing value"", Strategic Organization, Issue 3, 211-225, with B. Silverman, T. Zenger, 2007","""Problem Solving and the Entrepreneurial Theory of the Firm"", Journal of Management Studies, Issue 5, 211-225, with C. Hsieh, T. Zenger, 2007"
Sara Bormann,Postdoctoral Research Associate,https://olin.wustl.edu/EN-US/Faculty-Research/Faculty/Pages/FacultyDetail.aspx?username=sarabormann,sarabormann@wustl.edu,,"Sara Bormann joined Olin Business School in 2015 after graduating from Mannheim University, Germany. Prior to her PhD, she worked in the Forensic Accounting Department at PricewaterhouseCoopers.",nocv,"Managerial Accounting, Incentives, Relational Contracts, manager traits"
