name,title,url,email,ed,bio,cvlink,interests,publicationsDaniel Gottlieb,Assistant Professor of Economics,https://olin.wustl.edu/EN-US/Faculty-Research/Faculty/Pages/FacultyDetail.aspx?username=d.gottlieb,dgottlieb@wustl.edu,"PhD 2009, MIT
MA 2004, Getulio Vargas Foundation
BA 2001, Ibmec Business School",,http://apps.olin.wustl.edu/cv/faculty/d.gottlieb.pdf,"Contract Theory, Behavioral Economics, Insurance","""Imperfect Memory and Choice Under Risk"", Games and Economic Behavior, Issue 85, 127-158, 2014","""Should Educational Policies Be Regressive?"", Journal of Public Economic Theory, Issue 4, 601-623, with H. Moreira, 2012","""Risk-Neutral Firms Can Extract Unbounded Profits from Consumers with Prospect Theory Preferences"", Journal of Economic Theory, Issue 3, 1291-1299, with E. Azevedo, 2012","""Competition Over Time-Inconsistent Consumers"", Journal of Public Economic Theory, 673-684, 2008","""A Model of Mixed Signals with Applications to Countersignaling"", RAND Journal of Economics, 1020-1043, with A. Araujo, H. Moreira, 2007","""Asymmetric Information in late 19th century Cooperative Insurance Societies"", Explorations in Economic History, 270-292, 2007","""Perfect Competition in Markets with Adverse Selection"", Econometrica, forthcoming, with E. Azevedo"
Steve Nowlis,August A. Busch Jr. Distinguished Professor of Marketing,https://olin.wustl.edu/EN-US/Faculty-Research/Faculty/Pages/FacultyDetail.aspx?username=nowlis,nowlis@wustl.edu,"PhD 1994, Haas School of Business
MBA 1990, Haas School of Business
BA 1986, Stanford University","A January 2009 study in the Journal of Marketing (by Seggie and Griffith) found that Steve is the 18th most productive marketing professor in the world in terms of his publications. He is the winner of the 2001 William F. O'Dell Award and the 2001 Early Career Contribution Award. He has published numerous papers in top-tier marketing journals. He has served as an expert witness in cases involving trademark infringement, deceptive advertising, survey research, class action certification, and other issues",http://apps.olin.wustl.edu/faculty/Nowlis/CV.pdf,"Consumer Behavior, decision making, and consumption."
William Bottom,Joyce and Howard Wood Distinguished Professor of Organizational Behavior,https://olin.wustl.edu/EN-US/Faculty-Research/Faculty/Pages/FacultyDetail.aspx?username=bottomb,bottomb@wustl.edu,"PhD 1989, University of Illinois @ Urbana-Champaign
MA 1986, University of Illinois @ Urbana-Champaign
BA 1983, University of Illinois @ Urbana-Champaign","William Bottom studies social and psychological aspects of bargaining, negotiation and group decision making. His current work examines how emotional and relational factors influence the implementation of negotiated agreements. Having previously served as Senior Associate Dean and the Director of the PhD Program at the Olin School, Bottom is also studying the impact of social science on business education and global business practice. He has been awarded the John F. Mee Award for Distinguished Contribution to Management History, the Marcile and James Reid Chair, and research grants from the Russell Sage Foundation and the National Science Foundation. Bottom is actively engaged in consulting and executive education serving a range of clients in the areas of negotiation, team development, and organizational development.",nocv,"Organizational behavior, behavioral decision theory, negotiation","""On the role of personality, cognitive ability, and emotional intelligence in predicting negotiation outcomes: A meta-analysis"", Organizational Psychology Review, Issue 4, 293-336, with S. Sharma, H. Elfenbein, 2013","""After the Deal: Talk, Trust Building and the Implementation of Negotiated Agreements"", Organizational Behavior and Human Decision Processes, with R. Campagna, A. Mislin, 2011","""Essence of Negotiation: Understanding Appeasement and The Great Munich Stereotype"", Negotiation Journal, Issue 4, 379-415, 2010","""Organizing Intelligence: Development of behavioral science and the research based model of business education"", Journal of the History of Behavioral Sciences, Issue 3, 253-283, 2009","""Building a pathway to cooperation: Negotiation and social exchange between principal and agent"", Administrative Science Quarterly(Working Paper), with J. Holloway, G. Miller, A. Mislin, A. Whitford, 2006","""Adaptive aspirations and contributions to a public good: Generic advertising as a response to decline"", Organizational Behavior and Human Decision Processes, 22-33, with S. Krishnamurthy, A. Rao, 2003","""Propagation of individual bias through group decision making: Error in the treatment of asymmetrically informative signals"", Journal of Risk and Uncertainty, 147-163, with K. Ladha, G. Miller, 2002","""When talk is not cheap: Substantive penance and expressions of intent in rebuilding cooperation"", Organization Science, 497-513, with K. Gibson, S. Daniels, J. Murnighan, 2002"
Stuart Greenbaum,Former Dean and Bank of America Professor Emeritus of Managerial Leadership,https://olin.wustl.edu/EN-US/Faculty-Research/Faculty/Pages/FacultyDetail.aspx?username=greenbaum,greenbaum@wustl.edu,"PhD 1965, John Hopkins University
BS 1959, New York University","Stuart Greenbaum is the former Dean and Bank of America Emeritus Professor of Managerial Leadership at the Olin Business School, Washington University in St. Louis. He is also the Jacobs Visiting Professor at the Kellogg School of Management, Northwestern University. Before joining the Olin School in 1995, Greenbaum served for 20 years on the faculty of the Kellogg School of Management where he was the Director of the Banking Research Center and the Strunk Distinguished Professor of Financial Institutions. From 1988-92, he was Kellogg's Associate Dean for Academic Affairs. Before Northwestern, Greenbaum served as Chairman of the Economics Department at the University of Kentucky, and on the staffs of the Comptroller of the Currency and the Federal Reserve. Professor Greenbaum has on numerous occasions testified before Congressional committees, as well as other legislative bodies. Greenbaum has published two books and more than 75 articles in academic journals and other professional media. He is founding editor of the Journal of Financial Intermediation and has served on the editorial boards of eleven other academic journals.",http://apps.olin.wustl.edu/faculty/greenbaum/CV.pdf,"Corporate Governance, Risk Management, Banking and Financial Intermediation","""Management Education & its Contemporary Critics"", Zeitschrift fur Controlling und Innovations Management, Issue 2, 38-42, 2005","""Financial Intermediaries"", The W.G. & L. Handbook of Financial Markets, 17-32, with W. Emmons, 1997","""Twenty-Five Years of Banking Research"", Financial Management, Issue 2, 86-92, 1996","""Reputation and Discretion in Financial Contracting"", American Economic Review, Issue 5, 1165-1183, with A. Thakor, A. Boot, 1993"
Yongwook (Yong) Paik,Visiting Assistant Professor of Strategy,https://olin.wustl.edu/EN-US/Faculty-Research/Faculty/Pages/FacultyDetail.aspx?username=ypaik,ypaik@wustl.edu,"PhD 2009, UC Berkeley
MS 2006, UC Berkeley
BS 2001, Seoul National University","Professor Paik's research focuses on entrepreneurship, innovation, business strategy and how public policies and institutions affect them. He serves as a referee for numerous academic journals in strategy, management, and economics. Professor Paik joined Olin in 2015. Prior to joining Olin, he was an assistant professor at the Marshall School of Business, University of Southern California (USC). He completed his PhD in Economics at the University of California Berkeley. Prior to his PhD, he worked as a patent attorney in one of the largest law firms in South Korea, Kim & Chang, serving multinational corporations as well as small and medium-sized entrepreneurial companies.",nocv,"Entrepreneurship, Innovation, Institutions, Business Strategy and Public Policy","""The Effects of Corporate Venture Capital, Founder Incumbency, and Their Interaction on Entrepreneurial Firms’ R&D Investment Strategies"", with H. Woo","""The Impact of Patent Wars on Firm Strategy: Evidence from the Global Smartphone Industry"", Organization Science, forthcoming, with F. Zhu","""Serial Entrepreneurs and Venture Performance: Evidence from U.S. Venture-Capital-Financed Semiconductor Firms"", Strategic Entrepreneurship Journal, Issue 3, 254-268, 2014","""Economic Downturn and Financing Innovative Startup Firms."", Managerial and Decision Economics, Issue 2, 114-128, with H. Woo, 2014","""The Bankruptcy Reform Act of 2005 and Entrepreneurial Activity"", Journal of Economics & Management Strategy, Issue 2, 259-280, 2013"
Peter Boumgarden,Visiting Assistant Professor of Organizational Behavior,https://olin.wustl.edu/EN-US/Faculty-Research/Faculty/Pages/FacultyDetail.aspx?username=boumgardenp,boumgardenp@wustl.edu,"PhD 2010, Washington University in St. Louis, Olin Business School","Peter Boumgarden joined the Olin faculty in a visiting professor role in 2016. His main stream of research is around the role of structure- both formal and informal- in sharing outcomes such as innovation in groups and organizations. In addition to his academic work, Dr. Boumgarden has consulted with organizations of a variety of sciences regarding their strategic direction and routes towards driving increased innovation.",nocv,"Groups and Teams, Innovation, Organization Structure, Entrepreneurship","""Accounting for reciprocity in negotiation and social exchange"", Judgment and Decision Making, Issue 6, with A. Mislin, D. Jang, W. Bottom, 2015","""How a Cartoon Caption Contest Can Make You a Better Writer"", Harvard Business Review Online, 2015","""Structure and Learning in Self-Managed Teams: Why “Bureaucratic” Teams Can Be Better Learners"", Organization Science, Issue 3, with J. Bunderson, 2010","""Sailing into the Wind: Exploring the Relationships Among Ambidexterity, Vacillation and Organizational Performance"", Strategic Management Journal, Issue 6, 33, 587-610, with J. Nickerson, T. Zenger, 2012"
Mahendra Gupta,Former Dean and Geraldine J. and Robert L. Virgil Professor of Accounting and Management,https://olin.wustl.edu/EN-US/Faculty-Research/Faculty/Pages/FacultyDetail.aspx?username=gupta.mahendra,guptam@wustl.edu,"PhD 1990, Stanford University, Graduate School of Business
MS 1981, Carnegie Mellon University - GSIA
BS 1978, Bombay University","Gupta was appointed dean of the Olin Business School at Washington University in St. Louis in July 2005. He has served on the Olin faculty since 1990 and in 2004 was named the Geraldine J. and Robert L. Virgil Professor of Accounting and Management. Students have given him the Reid Teaching Award eight times since 2001. He was chosen the Marcile and James Reid Professor for 1996-1997. Gupta's research has been published in leading academic journals in the United States and abroad. He has served on several editorial boards including The Accounting Review, The Journal of Management Accounting Research, Canadian Accounting Review, and Accounting Horizons. He is a frequent speaker at research workshops and conferences worldwide. Gupta has been a consultant to various firms and government agencies. He serves on Brown Shoe Company's board of directors and audit committee. He has served on the boards of Dance St. Louis, Junior Achievement and the Consortium for Graduate Study in Management, and currently serves on the advisory committees for the Center for the Study of Ethics and Human Values, and the Center for Health Policy.",nocv,"Managerial accounting, strategic cost management and control","""Understanding Customer Level Profitability Implications of Satisfaction Programs"", Journal of Business & Industrial Marketing, Issue 7, with R. Niraj, G. Foster, C. Narasimhan, 2008","""Staging Venture Capital: Empirical Evidence on the Differential Roles of Early Versus Late Rounds""(Working Paper), with A. Davilla, G. Foster","""Customer Profitability in a Supply Chain"", Journal of Marketing, Issue 3, with R. Niraj, C. Narasimhan, 2001","""Estimation of Benchmark Performance Standards: An Application to Public School Expenditures"", Journal of Accounting & Economics, Issue 2, with N. Dopuch, 1997","""Product Cost Information & Cost-Based: An Experimental Investigation"", Contemporary Accounting Research, with R. King, 1997"
Giorgia Piacentino,Assistant Professor of Finance,https://olin.wustl.edu/EN-US/Faculty-Research/Faculty/Pages/FacultyDetail.aspx?username=piacentino,piacentino@wustl.edu,"PhD 2013, London School of Economics
M.Sc. 2009, Toulouse School of Economics
M.Sc. 2008, Rome Rot Vergata University
B.Sc. 2005, Rome Third University",Welcome to my Olin webpage! I joined Olin as an assistant professor in 2013 after completing my PhD at the London School of Economics. You can find some information about me clicking on the link below. This will direct you to my personal webpage.,nocv,"My work is in intermediation theory, banking, contracting and corporate governance."
Stuart Bunderson,Associate Dean & Director of Executive Programs and George & Carol Bauer Professor of Organizational Ethics & Governance and Co-Director of the Bauer Leadership Center,https://olin.wustl.edu/EN-US/Faculty-Research/Faculty/Pages/FacultyDetail.aspx?username=bunderson,bunderson@wustl.edu,"PhD 1998, Carlson School of Management - University of Minnesota
MS 1993, Marriott School of Management - Brigham Young University
BS 1991, Brigham Young University","Professor Bunderson has taught at the University of Minnesota and at Brigham Young University. Before coming to Olin, he worked in organization and management development at PepsiCo, Inc., and studied change management at Allina Health System.",http://apps.olin.wustl.edu/faculty/bunderson/CV.pdf,Learning and knowledge management; social hierarchy; meaningful work; groups and teams,"""Different Views of Hierarchy and Why They Matter: Hierarchy as Inequality or as Cascading Influence"", Academy of Management Journal, with G. Van der Vegt, Y. Cantimur, F. Rink","""Power, status, and learning in organizations"", Organization Science, Issue 5, 1182-1194, with R. Reagans, 2011","""Status cues and expertise assessment in groups: How group members size one another up and why it matters"", Cambridge University Press, 215-237, with M. Barton, 2011","""Power asymmetry and learning in teams: The moderating role of performance feedback"", Organization Science, 347-361, with S. DeJong, G. Van der Vegt, E. Molleman, 2010","""Structure and learning in self-managed teams: Why 'bureaucratic' teams can be better learners"", Organization Science, 609-624, with P. Boumgarden, 2010","""The call of the wild: Zookeepers, callings, and the dual edges of deeply meaningful work"", Administrative Science Quarterly, 32-57, with J. Thompson, 2009","""Expertness diversity and interpersonal helping in teams: Why those who need the most help end up getting the least"", Academy of Management Journal, Issue 5, 877-893, with G. Van der Vegt, A. Oosterhof, 2006","""Learning and performance in multi-disciplinary teams: The importance of collective team identification"", Academy of Management Journal, 532-547, with G. Van der Vegt, 2005"
Bruce Hall,"Professor of Health Care Management, Olin Business School and Professor of Surgery, School of Medicine",https://olin.wustl.edu/EN-US/Faculty-Research/Faculty/Pages/FacultyDetail.aspx?username=hallb,hallb@wustl.edu,,"Dr. Hall trained in general surgery at the Brigham and Women's Hospital (Harvard Medical School) from 1992 through 1997. He remained on staff at Harvard and Brigham as Assistant to the Surgeon in Chief. In 1999 he worked for McKinsey Consulting in their healthcare practice. In 2000 Dr. Hall joined the Department of Surgery at Washington University/Barnes-Jewish Hospital in Saint Louis, and joined the Olin Business School faculty as well. Dr. Hall's clinical expertise includes thyroid and parathyroid surgery, surgical oncology, and trauma care. Holding dual appointments as Associate Professor in the Department of Surgery and the Olin Business School, he teaches topics for the business school such as health care economics, insurance theory, health policy, and healthcare management.",nocv,"Dr. Hall has focused his research on the evaluation of quality in medicine and surgery, particularly as it pertains to individual providers and their contribution to the health care system. He has particular interest in the theory of risk adjustment."
Lamar Pierce,Associate Professor of Organization & Strategy,https://olin.wustl.edu/EN-US/Faculty-Research/Faculty/Pages/FacultyDetail.aspx?username=pierce,pierce@wustl.edu,"PhD 2005, University of California, Berkeley
MS 2001, University of California, Berkeley
BA 1997, University of Puget Sound
BS 1997, University of Puget Sound","Lamar Pierce joined the Olin faculty in 2007, after visiting at Carnegie Mellon for two years. Prior to earning his PhD at the University of California, Berkeley, he worked at Boeing in Seattle, WA. Pierce's research focuses on economic and psychological factors that impact both productivity and misconduct, and the organizational solutions to jointly address these effects. Pierce teaches Strategy, Management, Business Ethics in the MBA, Undergraduate, and Executive MBA programs at Olin.",http://apps.olin.wustl.edu/faculty/pierce/CV.pdf,Business strategy and public policy; fraud and corruption; ethics; incentives in organizations,"""Motivational Spillovers from Awards: Crowding Out in a Multitasking Environment"", Organization Science, Issue 2, 286-303, with T. Gubler, I. Larkin, 2016","""Subprime Governance: Agency Costs in Vertically Integrated Banks and 2008 Mortgage Crisis"", Strategic Management Journal, Forthcoming, with C. Gartenberg, 2016","""Motivation Matters: Corporate Scope and Competition in Complementary Product Markets"", Strategic Management Journal, Issue 7, 1304-1315, with V. Bennett, 2016","""Cleaning House: The Impact of Information Technology on Employee Corruption and Productivity"", Management Science, Issue 10, 2299-2319, with D. Snow, A. McAfee, 2015","""Unethical Demand and Employee Turnover"", Journal of Business Ethics, Issue 4, 853-869, with J. Snyder, 2015","""Healthy, Wealthy, and Wise: Retirement Planning Predicts Health Improvements"", Psychological Science, Issue 9, 1822-1830, with T. Gubler, 2014","""The Psychological Costs of Pay-For-Performance: Implications for the Strategic Compensation of Employees"", Strategic Management Journal, Issue 10, 1194-1214, with I. Larkin, F. Gino, 2012","""Customer-Driven Misconduct: How Competition Corrupts Business Practices"", Management Science, Issue 8, 1725-1742, with V. Bennett, J. Snyder, M. Toffel, 2013","""The Role of Organizational Scope and Governance in Strengthening Private Regulatory Monitoring"", Organization Science, Issue 5, 1558-1584, with M. Toffel, 2013","""Organizational Structure and the Limits of Knowledge Sharing: Incentive Conflict and Agency In Car Leasing"", Management Science, Issue 6, 1106-1121, 2012"
Jian Cai,Visiting Assistant Professor of Finance,https://olin.wustl.edu/EN-US/Faculty-Research/Faculty/Pages/FacultyDetail.aspx?username=caij,caij@wustl.edu,"PhD 2009, Washington University in St. Louis
MBA 2004, Washington Universtiy in St. Louis
MMR 1997, Southern Illinois University at Edwardsville
BS 1995, Fudan University","Professor Cai was previously a research economist at Federal Reserve Bank of Cleveland and an assistant professor of finance at Fordham University. She also taught at Case Western Reserve University. Prior to her Ph.D., she worked as a research manager, business intelligence analyst, and bank officer for seven years.",nocv,"Corporate Finance, Financial Intermediation, Empirical Asset Pricing, Banking, Corporate Governance, Career Concerns"
Chad Ham,Assistant Professor of Accounting,https://olin.wustl.edu/EN-US/Faculty-Research/Faculty/Pages/FacultyDetail.aspx?username=cham,cham@wustl.edu,"PhD 2015, University of Maryland
MACC 2010, Villanova University
BSBA 2007, Bucknell University",,http://www.sites.google.com/site/charleschadham/resume,"Financial accounting, corporate governance, litigation, manager traits"
Robert Pollak,Hernreich Distinguished Professor of Economics - joint with Arts & Sciences,https://olin.wustl.edu/EN-US/Faculty-Research/Faculty/Pages/FacultyDetail.aspx?username=pollak,pollak@wustl.edu,,"Robert Pollak's research interests include environmental policy, demography and the economics of the family. Pollak is the author of numerous articles in professional journals and three books: From Parent to Child: Intrahousehold Allocations and Intergenerational Relations in the United States (1995, with J. Behrman and P. Taubman), Demand System Specification and Estimation (1992, with T. Wales), and The Theory of the Cost-of-Living Index (1989). Pollak is a fellow of the American Academy of Arts and Sciences, the American Association for the Advancement of Science and the Econometric Society. He is a Research Associate of the National Bureau of Economic Research (NBER). Pollak served on the National Academy of Sciences Committee on the National Statistics panel on Cost-of-Living Indexes and is now serving on the Standing Committee on Research and Evidentiary Standards. Pollak has served as Senior Consultant to the Economics Initiative of the John D. and Catherine T. MacArthur Foundation. From 1997-2007, he co-chaired the MacArthur Foundation Network on the Family and the Economy, an interdisciplinary group of economists, sociologists, and developmental psychologists studying the functioning of families. Pollak was awarded a Fellowship for 1999-2000 by the John Simon Guggenheim Foundation. Pollak was President of the Midwest Economics Association in 2002-2003 and will be President of the Society of Labor Economists in 2009-2010.",http://apps.olin.wustl.edu/faculty/pollak/CV.pdf,"Environmental economics and policy; consumer demand analysis and consumer behavior; demography, labor economics and the economics of the family"
Tat Chan,Professor of Marketing,https://olin.wustl.edu/EN-US/Faculty-Research/Faculty/Pages/FacultyDetail.aspx?username=chan,chan@wustl.edu,"PhD 2001, Yale University
Masters of Philosophy 1999, Yale University
MA 1998, Yale University
MBA 1994, University of Hong Kong
BBA 1992, University of Hong Kong","Professor Chan Chan is an Associate Professor of Marketing at the Olin Business School, Washington University in St. Louis. He received a Ph.D. in Economics at Yale University in 2001. His research interests are in empirical modeling consumer choice and firm competition using econometric methodologies. He has conducted various research projects in the domain of economics and marketing. His research has been published in top journals such as Journal of Political Economy, RAND Journal of Economics, Marketing Science, Journal of Marketing Research and Management Science.",http://apps.olin.wustl.edu/faculty/chan/CV.pdf,"Industrial organization, applied econometrics, applied microeconomics, and marketing","""The Economic Values of Online Review"", Marketing Science, Issue 5, with H. Che, C. Wu","""Consumer Search Activities and the Value of Ad Positions in Sponsored Search Advertising"", Marketing Science, Issue 4, with Y. Park, 2015","""Learning from Peers: Knowledge Transfer and Salesforce Productivity Growth"", Marketing Science, with J. Li, L. Pierce, 2014","""Compensation and Peer Effects in Competing Sales Teams"", Management Science, with J. Li, L. Pierce, 2014","""Price Expectations and Purchase Decisions: Evidence from an Online Store Experiment"", Customer Needs and Solutions, with A. Cheema, S. Roy, 2014","""Treatment Effectiveness and Side Effects: A Model of Physician Learning"", Management Science, with C. Narasimhan, Y. Xie, 2012","""Measuring the Value of Customer Acquisition from Search Advertising"", Marketing Science, with C. Wu, Y. Xie, 2011"
Barton Hamilton,Robert Brookings Smith Distinguished Professor of Entrepreneurship,https://olin.wustl.edu/EN-US/Faculty-Research/Faculty/Pages/FacultyDetail.aspx?username=hamiltonb,hamiltonb@wustl.edu,"PhD 1993, Stanford University
BA 1985, University of California - Berkeley","Before joining Olin, Professor Hamilton was an Assistant Professor of Economics at McGill University for five years.",http://apps.olin.wustl.edu/faculty/hamiltonb/CV.pdf,"Entrepreneurship, health economics, labor economics, econometrics.","""Diversity & Productivity in Production Teams"", Emerald Group Publishing Limited, 99-138, with J. Nickerson, H. Owan","""Team Incentives & Worker Heterogeneity: An Empirical Analysis of the Impact of Teams on Productivity & Participation"", Journal of Political Economy, 465-497, with J. Nickerson, H. Owan, 2003","""Competition, Insurance, and Quality in the Market for Advanced Infertility Treatment"", Health Economics(Working Paper), 994-1016, with B. McManus, 2012","""Correcting for Endogeneity in Strategic Management Research"", Strategic Organization, Issue 1, 53-80, with J. Nickerson, 2003","""An Empirical Analysis of Career Dynamics & Internal Labor Markets during the Great Depression"", Journal of Labor Economics, with M. MacKinnon, 2002"
Iva Rashkova,Assistant Professor of Operations & Manufacturing Management,https://olin.wustl.edu/EN-US/Faculty-Research/Faculty/Pages/FacultyDetail.aspx?username=irashkova,irashkova@wustl.edu,"PhD 2015, London Business School
MA 2009, Yale University
BS 2007, California Institute of Technology",,nocv,"Financial considerations for inventory management, medical shortages, developing countries","""National Drug Stockout Risks and the Global Fund Disbursement Process for Procurement"", Production and Operations Management, with J. Gallien, P. Yadav, R. Atun"
