name,title,url,email,ed,bio,cvlink,interests,publicationsKimball Chapman,Assistant Professor of Accounting,https://olin.wustl.edu/EN-US/Faculty-Research/Faculty/Pages/FacultyDetail.aspx?username=kimballchapman,kimballchapman@wustl.edu,"PhD 2015, Penn State University
MBA 2002, University of Illinois","Kimball Chapman joined Olin Business School in 2015 after graduating from Penn State University. Prior to his PhD, he was the senior director of Investor Relations at Cott Corporation, a private label beverage company. Office: Simon 225",http://drive.google.com/open?id=0B1gIvnqbbXl4M3p4UktvclJOa2s,Kimball conducts empirical (archival) research on how accounting information and firm disclosures affect financial markets. Current projects address questions related to how analysts' demands for firm-specific information influence managers' long-term disclosure choices; how investor relations officer tenure influences investor uncertainty; and the role of attention-motivated stock trading in explaining the earnings announcement premium. Kimball is also working on early-stage projects related to how investor characteristics influence managers' disclosure choices and how social norms influence managers' disclosure choices around earnings announcements.
Clifford Holekamp,"Senior Lecturer in Entrepreneurship, Academic Director for Entrepreneurship, Director of the Entrepreneurship Platform",https://olin.wustl.edu/EN-US/Faculty-Research/Faculty/Pages/FacultyDetail.aspx?username=holekampc,holekampc@wustl.edu,"MBA 2001, Olin Business School, Washington University in St. Louis
BA 1996, Washington & Lee University","Cliff Holekamp grew up in Los Angeles and worked as an account executive for IBM in Nashville before coming to Olin, first as a student. After developing the concept in Olin's entrepreneurship program, he founded a chain of healthcare centers which he later sold to a private equity group. Prof. Holekamp was the founding director of the Entrepreneurship Platform, was the co-founder and architect of the social entrepreneurship programs at Olin and at the Brown School of Social Work, and has launched several new entrepreneurship courses including programs in Hungary and Israel. In addition to teaching, Prof. Holekamp is a co-founder and general partner at Cultivation Capital, an early stage venture capital firm.",nocv,noint
Patrick Rishe,"Director, Sports Business Program & Senior Lecturer of Management",https://olin.wustl.edu/EN-US/Faculty-Research/Faculty/Pages/FacultyDetail.aspx?username=prishe,prishe@wustl.edu,"PhD 1997, Binghamton University
MS 1993, University of North Carolina-Charlotte
BA 1992, University of North Carolina-Charlotte","Dr. Rishe began his term as the Director of Olin's Sports Business Program in June 2015. He also is the Founder and President of the sports consulting firm Sportsimpacts founded in 2000, and since 2010 has been a contributing Sports Business writer for Forbes.com. Prior to joining Washington University, he was a Full Professor of Economics at Webster University where he had been a tenured faculty member since 2003. He has previously taught his popular Sports Business course as a visiting lecturer at UCLA, Loyola Marymount University, Pepperdine University, and Saint Louis University. He has also been an invited guest speaker at Harvard's Sports Law Symposium, NYU's Tisch School of Management, and in 2015 moderated panels at both the MIT Sports Analytics Conference and Stanford's Sports Innovation Conference.",http://drive.google.com/file/d/0B93XSOFEj_rcLWo2NDAtM2hCbnM/view?usp=sharing,"Secondary Ticket Pricing in Sports, Economic Impact Studies, Estimating Athlete Endorsement Value, Estimating Franchise Value","""A Heterogeneous Analysis of Secondary Market Transactions for College Football Bowl Games"", Sport Marketing Quarterly/FIT Publishing, Issue 10, 357-374, with D. Sanders, J. Reese, M. Mondello, 2016","""Secondary Market Behavior during College Football's Postseason: Evidence from the 2014 Rose Bowl and BCS Championship Game"", International Journal of Sport Finance, Issue 2, with B. Boyle, J. Reese, 2016","""How Event Significance, Pent-up Demand, Playoff Oversaturation, and Series-clinching Euphoria Can Impact Secondary Market Behavior in Major League Baseball's Postseason"", Journal of Sports Management and Commercialization, with B. Boyle, J. Reese, 2014","""How Event Significance, Team Quality and School Proximity Impact March Madness Markups"", Sports Marketing Quarterly, Issue 4, 148-160, with M. Mondello, B. Boyle, 2014","""Do Mobile Sporting Events Produce Net Increases in Tourism, Local Hotel Revenues, and Overall Economic Impact? Evidence Using Smith Travel Research Data"", Mustang Journal of Business and Ethics, 15-30, 2014","""Pricing Insanity at March Madness: Exploring the Causes of Secondary Price Markups at the 2013 Final Four"", International Journal of Sports and Society, Issue 2, 67-78, 2014"
Sergio Chayet,Director of the Master of Science in Supply Chain Management Program; Director of the Operations & Supply Chain Management MBA Platform; Senior Lecturer in Operations & Manufacturing Management,https://olin.wustl.edu/EN-US/Faculty-Research/Faculty/Pages/FacultyDetail.aspx?username=chayet,chayet@wustl.edu,"PhD 1999, Northwestern University
MS 1994, Northwestern University
MS 1992, University of Chicago
BS 1988, Universidad Nacional Autonoma de Mexico","Prior to joining Olin, Professor Chayet served as an assistant professor at the University of Chicago Graduate School of Business. He was a teaching and research assistant while pursuing his doctoral studies at Northwestern University. Professor Chayet was also a developer in the QCOOM project jointly sponsored by Motorola and the National Science Foundation. He has been an external consultant to ZS Associates.",nocv,Strategic planning for production and service organizations using queueing and game-theoretic models; control and management of manufacturing systems; stochastic models for production systems; customer-supplier relationships.,"""Risk-Sensitive Strategic Capacity Planning"", with W. Hopp","""Sequential Entry with Capacity, Price, and Lead time Competition"", with W. Hopp","""""The Marketing-Operations Interface,"" in Handbook of Quantitative Supply Chain Analysis: Modeling in the E-business Era"", Springer, Issue Part III. Supply Chain Coordinations in E-Business, 295-334, 2004","""An Algorithm to Relate General Solutions of Different Bidimensional Problems"", Journal of Mathematical Physics, Issue 6, 1491-1497, with S. Hojman, D. Nunez, M. Roque, 1991","""Using an Optimized Queueing Network Model to Support Wafer Fab Design"", IIE Transactions, Issue 2, 119-130, with W. Hopp, M. Spearman, K. Donohue, E. Gel, 2002"
John Horn,Senior Lecturer in Economics,https://olin.wustl.edu/EN-US/Faculty-Research/Faculty/Pages/FacultyDetail.aspx?username=johnhorn,johnhorn@wustl.edu,"PhD 1998, Harvard University
MA 1994, Harvard University
BA 1991, University of Michigan","John was a Senior Expert in the Strategy Practice of McKinsey & Company, based out of the Washington, DC, office, before joining Olin. He spent most of his 9 years there working with clients on competitive strategy, war gaming workshops and corporate and business unit strategy across a variety of industries and geographies. John helped over 100 clients with war game workshops and developed a set of simulation exercises to help companies understand the challenges of reallocating resources. He was also an adjunct professor at the Robert H. Smith School of Business at the University of Maryland. Prior to joining McKinsey, John assisted major U.S. financial institutions with fair lending compliance as a consultant with Ernst & Young LLP. He also worked as an economic consultant with The Brattle Group, specializing in economic expert testimony in litigation support, including anti-trust and patent infringement cases.",nocv,"Competitive Dynamics, Entrepreneurship","""Battle-Test Your Innovation Strategy"", McKinsey Quarterly, with M. Capozzi, A. Kellen, 2012","""Deals Without Delusions"", Harvard Business Review, with D. Lovallo, P. Viguerie, R. Uhlaner, 2007","""Learning to Let Go"", McKinsey Quarterly, with D. Lovallo, P. Viguerie, 2006","""Beating the Odds in Market Entry"", McKinsey Quarterly, with D. Lovallo, P. Viguerie, 2005","""Predicting Your Competitor's Reaction"", Harvard Business Review, with K. Coyne, 2009","""A Truer Picture of China's Export Machine"", McKinsey Quarterly, with V. Singer, J. Woetzel, 2010","""Overcoming Biases in M&A: A Process Perspective"", Advances in Mergers and Acquisitions, 83-104, with M. Garbulo, D. Lovallo, 2010","""Restarting the Small-Business Growth Engine"", McKinsey Quarterly, with D. Pleasance, 2012","""Playing War Games to Win"", McKinsey Quarterly, 2011","""Getting Into Your Computer's Head"", McKinsey Quarterly, with H. Courtney, J. Kar, 2009"
Scott Roeder,Postdoctoral Research Associate in Marketing,https://olin.wustl.edu/EN-US/Faculty-Research/Faculty/Pages/FacultyDetail.aspx?username=sroeder,sroeder@wustl.edu,,,http://scottroeder.net/papers/scott_roeder_cv.pdf,noint
Siddhartha Chib,Harry C. Hartkopf Professor of Econometrics and Statistics,https://olin.wustl.edu/EN-US/Faculty-Research/Faculty/Pages/FacultyDetail.aspx?username=chib,chib@wustl.edu,"PhD 1986, University of California, Santa Barbara
MA 1984, University of California, Santa Barbara
MBA 1982, Indian Institute of Management, Ahmedabad
BA 1979, St. Stephens College, Delhi University","Professor Chib's research is in the area of Bayesian statistics and Markov chain Monte Carlo computational methods. He has published papers on a number of different topics including the analysis of binary and ordinal data, Markov mixture models, stochastic volatility, Metropolis-Hastings algorithms and model choice. He is a Fellow of the American Statistical Association.",nocv,"Bayesian statistics and econometrics, Markov chain Monte Carlo methods","""Marginal Likelihood and Bayes Factors for Dirichlet Process Mixture Models"", Journal of the American Statistical Association, with S. Basu, 2003","""Marginal Likelihood from the Metropolis-Hastings Output"", Journal of the American Statistical Association, with I. Jeliakov, 2001","""Stochastic Volatility: Likelihood Inference and Comparison with ARCH Models"", Review of Economic Studies, with S. Kim, N., 1998","""Analysis of Multivariate Probit Models"", Blometrika, with E. Greenberg, 1998","""Understanding the Metropolis-Hastings Algorithm"", American Statistician, with E. Greenberg, 1995","""Marginal Likelihood from the Gibbs Output"", American Statistical Association, 1995","""Bayesian Analysis of Binary and Polychotomous Response Data"", Journal of the American Statistical Association, with J. Albert, 1993"
Jared Jennings,Assistant Professor of Accounting,https://olin.wustl.edu/EN-US/Faculty-Research/Faculty/Pages/FacultyDetail.aspx?username=jaredjennings,jaredjennings@wustl.edu,"PhD 2012, University of Washington
BS 2004, Brigham Young University, Marriott School of Business
MA 2004, Brigham Young University","Jared Jennings joined Olin Business School in 2012 after graduating from the University of Washington. Prior to his PhD, he was an auditor at Deloitte. His research primarily focuses on voluntary disclosure and sell-side analysts.",nocv,"Information asymmetry, voluntary disclosure, and sell-side analysts","""Do Managers Define Non-GAAP Earnings to Meet or Beat Analyst Forecasts?"", Journal of Accounting and Economics, Issue 1, 40-56, with J. Doyle, M. Soliman, 2013"
Stephen Ryan,Professor of Economics,https://olin.wustl.edu/EN-US/Faculty-Research/Faculty/Pages/FacultyDetail.aspx?username=stephen.p.ryan,stephen.p.ryan@wustl.edu,,,http://sites.wustl.edu/stephenpryan/home/cv/,noint
Samuel Chun,Assistant Dean of Executive Programs and Senior Lecturer in Management Practice,https://olin.wustl.edu/EN-US/Faculty-Research/Faculty/Pages/FacultyDetail.aspx?username=schun,schun@wustl.edu,"PhD 1995, Washington University in St. Louis
BA 1985, Grinnell College","Samuel Chun is Assistant Dean of Executive Programs and Senior Lecturer of Management Practice at the Olin Business School, Washington University in St. Louis. Before joining Olin, he was an Assistant Professor of Business Administration at the Harvard Business School from 1995-2000, where he instructed MBAs, doctoral candidates, and corporate executives in sales, marketing, new product development and general management. Prior employment included service as a Regional Director at American Express and President of Intermarkets, Inc., a Pacific Rim-based Supply-Chain Management software manufacturer. He was also an economist and consultant to the United States Department of Labor.",nocv,noint
Baojun Jiang,Assistant Professor of Marketing,https://olin.wustl.edu/EN-US/Faculty-Research/Faculty/Pages/FacultyDetail.aspx?username=baojunjiang,baojunjiang@wustl.edu,"PhD 2011, Carnegie Mellon University
MS 2007, Carnegie Mellon University
MBA 2005, University of Texas at Austin
MS 2000, Stanford University
MS 1999, Stanford University (Ph.D. Candidate, 1998-2000)
BA 1997, Grinnell College",,nocv,"Competitive strategy, behavioral economics, the sharing economy, platform-based business models, pricing, distribution channels, innovation, operations/marketing interface, game theory.","""Collaborative consumption: Strategic and economic implications of product sharing"", Management Science, forthcoming, with L. Tian","""Anticipated regret and product innovation"", Management Science (forthcoming), with C. Narasimhan, O. Turut","""Comment on ‘Strategic information under leakage in a supply chain’."", Management Science (forthcoming), with L. Tian","""Signaling through price and quality to consumers with fairness concerns"", Journal of Marketing Research, forthcoming, with X. Guo","""Pricing and persuasive advertising in a differentiated market"", Marketing Letters, Issue 3, 579-588, with K. Srinivasan, 2016","""To share or not to share: Demand forecast sharing in a distribution channel"", Marketing Science, forthcoming, with L. Tian, Y. Xu, F. Zhang","""Signaling Through Pricing by Service Providers with Social Preferences"", Marketing Science(Working Paper), with J. Ni, K. Srinivasan, 2014","""Firm Strategies in the 'Mid Tail' of Platform-Based Retailing"", Marketing Science, Issue 5, 757-775, with K. Jerath, K. Srinivasan, 2011","""Impact of Consumer Reviews and Ratings on Sales, Prices, and Profits: Theory and Evidence"", ICIS 2008 Proceedings, Paper 141, with B. Wang, 2008"
Rich Ryffel,Senior Lecturer in Finance,https://olin.wustl.edu/EN-US/Faculty-Research/Faculty/Pages/FacultyDetail.aspx?username=ryffel,ryffel@wustl.edu,"MBA 1989, Boston University Graduate School of Management
BS 1984, Tufts University","Richard Ryffel is a senior lecturer at Washington University's Olin Business School. During his 30-year career in investment banking and asset management, Ryffel advised colleges and universities, hospitals, cities, states, airports, school districts, and corporations on financings and capital structure, and led hundreds of financings in both the taxable and tax-exempt markets. Mr. Ryffel joined Washington University full-time in 2015 after having worked at IBM Corporation, A.G. Edwards (now Wells Fargo Advisors), Bank of America, Edward Jones, and J.P. Morgan. He consults and writes in the areas of municipal finance and endowment management and governance.",nocv,"Municipal bonds, urban education policy"
Phech Colatat,Assistant Professor of Strategy,https://olin.wustl.edu/EN-US/Faculty-Research/Faculty/Pages/FacultyDetail.aspx?username=pcolatat,pcolatat@wustl.edu,"PhD 2014, MIT Sloan School of Management
SM 2009, Massachusetts Institute of Technology
MEng 2002, Cornell University
BS 2001, Cornell University","Colatat is a business school-trained sociologist with interests in healthcare, R&D and strategic management. Motivated by alarming trends in the prevalence of autism spectrum disorder (ASD), his current research examines the way organizational and social network processes affects the diagnostic process. He completed his PhD at the MIT Sloan School of Management.",nocv,"Organizational Theory; Economic Sociology; Organizational Learning; Social Networks; Science, Technology & Innovation; Medical Sociology; Social Epidemiology","""Collaborator novelty and creativity in the DARPA model of innovation"", Research Policy, 874-887, 2015"
Ohad Kadan,Professor of Finance,https://olin.wustl.edu/EN-US/Faculty-Research/Faculty/Pages/FacultyDetail.aspx?username=kadan,kadan@wustl.edu,"PhD 2002, Hebrew University of Jerusalem
MBA 1998, Hebrew University of Jerusalem
BS 1990, Hebrew University of Jerusalem","Ohad Kadan joined the Olin Business School in 2002. In his research he studies aspects of liquidity, information, and incentives in markets. He has studied the optimal design of electronic limit order markets. He has also studied the design of compensation contracts for both management and lower tier employees. His work also includes examinations of the bias analysts have toward the investment banks they research.",http://apps.olin.wustl.edu/faculty/kadan/CV.pdf,"Corporate finance, market microstructure, economics of information, and game theory"
Hillary Sale,Adjunct Lecturer,https://olin.wustl.edu/EN-US/Faculty-Research/Faculty/Pages/FacultyDetail.aspx?username=hillary.sale,hsale@wulaw.wustl.edu,"JD 1993, Harvard University
MA 1983, Boston University","Professor Hillary A. Sale, an expert in securities and corporate governance, ranks among the nation’s best scholars, teachers, and leaders in corporate and securities law. She is a frequent speaker to industry and academics on corporate governance, leadership and women’s leadership, and was selected as one of the 25 Most Influential Women in Business for 2014 by the St. Louis Business Journal. She will be the Sullivan & Cromwell Visiting Professor of Law at Harvard Law School in the spring of 2017, where she will teach Women’s Leadership and Corporate Boards and Governance. She is the co-author, with John C. Coffee and M. Todd Henderson, of a casebook on federal securities regulation, now in its 13th edition, and of a book on federal securities laws, rules, and forms. She has written extensively on various matters, including: redesigning the SEC, independent directors as securities monitors, derivative litigation, and corporate law and governance. Three of her articles were selected by Corporate Practice Commentator as among the annual ""top ten"" corporate and securities law articles. Professor Sale also regularly presents her scholarship at conferences and workshops throughout the country. At the law school, she is a recipient of the David M. Becker Professor of the Year Award and she also holds a courtesy appointment as a professor of management at the Olin School of Business. Among her professional affiliations, she is a member of the Executive Committee of DirectWomen and Chair of the DirectWomen Board Institute, an organization dedicated to educating women attorneys about public company boards. She also is a member of the American Law Institute and a member of the ABA Corporate Laws Committee. She previously was the F. Arnold Daum Chair in Corporate Finance and Law at the University of Iowa, where she received the President’s Collegiate Teaching Award. Before becoming a law professor, she clerked for the Hon. Richard S. Arnold, Chief Judge, U.S. Court of Appeals for the Eighth Circuit, and practiced law with Wilmer Hale LLP (formerly Hale and Dorr LLP) in Boston, specializing in corporate and securities litigation and internal investigations. She also held several positions with government entities in Massachusetts.",nocv,noint,"""Contracting for Publicness""","""Public Pay""","""On the Importance of Being Public""","""Securities Regulation"", Foundation Press (13th ed., 2015; Cases and Materials Supplement, 2014), with J. Coffee, Jr., M. Henderson, 2015","""Federal Securities Laws, Selected Statutes, Rules and Forms"", Foundation Press, with J. Coffee, Jr., M. Henderson, 2015","""We Believe: Omnicare, Legal Risk Disclosure and Corporate Government"", Duke Law Journal, with D. Langevoort, 2016","""Market Intermediation, Publicness, and Securities Class Actions"", Washington University Law Review, 1, with R. Thompson, 2016","""J.P. Morgan: An Anatomy of Corporate Publicness"", Brooklyn Law Review, 1630, 2014","""Public Governance"", George Washington Law Review, Issue 3, 101, 2013"
Cynthia Cryder,Associate Professor of Marketing,https://olin.wustl.edu/EN-US/Faculty-Research/Faculty/Pages/FacultyDetail.aspx?username=cryder,cryder@wustl.edu,"PhD 2009, Carnegie Mellon University
MS 2006, Carnegie Mellon University
BS 2004, Ohio State University",,http://apps.olin.wustl.edu/faculty/cryder/CV.pdf,Judgment and Decision Making; Prosocial Behavior; Incentives; Field and Internet Research Methodology,"""The Donor is in the Details"", Organizational Behavior and Human Decision Processes, Issue 1, 15-23, with G. Loewenstein, R. Scheines, 2013","""Winning the Battle but Losing the War: The Psychology of Debt Management"", Journal of Marketing Research, S38-S50, with M. Amar, D. Ariely, S. Ayal, S. Rick, 2011","""Tightwads and Spendthrifts"", Journal of Consumer Research, Issue 6, 767-782, with S. Rick, G. Loewenstein, 2008","""Misery is not Miserly: Sad and Self-Focused Individuals Spend More"", Psychological Science, 525-530, with J. Lerner, J. Gross, R. Dahl, 2008"
Zachary Kaplan,Assistant Professor of Accounting,https://olin.wustl.edu/EN-US/Faculty-Research/Faculty/Pages/FacultyDetail.aspx?username=zrkaplan,zrkaplan@wustl.edu,,,nocv,"How markets learn from disclosure, managerial disclosure strategy, analyst forecast strategy and the horizon of earnings expectations"
James Sawhill,Senior Lecturer in Marketing,https://olin.wustl.edu/EN-US/Faculty-Research/Faculty/Pages/FacultyDetail.aspx?username=sawhill,sawhill@wustl.edu,"PhD 2010, University of California, Berkeley
MS 1989, Massachusetts Institute of Technology
BA 1984, George Washington University","Prior to pursuing his doctoral studies, Professor Sawhill was a Senior Vice President with Wells Fargo and a Senior Associate with Booz-Allen and Hamilton. His teaching interests include marketing management, marketing strategy and sustainable marketing",nocv,"Consumer Choice Models, Behavioral Economics, Product Strategy, Pharmaceuticals marketing and Sustainability.","""Predicting Pharmaceutical Prices from Observable Factors"", Socio Economic Planning Sciences, with K. Iacocca, Y. Zhao, 2013"
Joseph Cullen,Assistant Professor of Economics,https://olin.wustl.edu/EN-US/Faculty-Research/Faculty/Pages/FacultyDetail.aspx?username=jacullen,jacullen@wustl.edu,"PhD 2009, University of Arizona
MA 2006, University of Arizona
BA 2002, University of Idaho","Joseph is an economist who studies the interaction between government regulation, business decisions, and the environment.",nocv,"Environmental Regulation, Energy Markets, Dynamics","""Bundling, Product Choice, and Efficiency: Should Cable Television Networks Be Offered a la Carte?"", Information Economics and Policy, Issue Issue 3-4, 379-404, with G. Crawford, 2007"
Michael Kinch,"Senior Lecturer in Business Practice and Assoc VC & Dir, Ctr Research Innov & Business",https://olin.wustl.edu/EN-US/Faculty-Research/Faculty/Pages/FacultyDetail.aspx?username=michael.kinch,michael.kinch@wustl.edu,"PhD 1993, Duke University Medical Center
BS 1989, The Ohio State University",,nocv,noint
Seethu Seetharaman,"W. Patrick McGinnis Professor of Marketing; Director, MS in Customer Analytics",https://olin.wustl.edu/EN-US/Faculty-Research/Faculty/Pages/FacultyDetail.aspx?username=seethu,seethu@wustl.edu,"PhD 1998, Cornell University
MS 1996, Cornell Univeristy
MS 1993, University of Utah
BA 1991, Indian Institute of Technology","Professor Seetharaman was an instructor in the marketing department at Cornell University during his doctoral studies. Professor Seetharaman's teaching interests include marketing research, marketing management and database marketing.",http://apps.olin.wustl.edu/faculty/seetharaman/CV.pdf,Understanding dynamic choice behavior of households using econometric models,"""Speed of Replacement: Modeling Brand Loyalty Using Last-Move Data"", Journal of Marketing Research, Issue 3, 494-505, with H. Che, 2009","""Price Competition in Markets with Consumer Variety Seeking"", Marketing Science, Issue 3, 516-525, with H. Che, 2009","""Too Close To Be Similar: Product and Price Competition in Retail Gasoline Markets"", Quantitative Marketing and Economics, Issue 3, 205-234, with G. Iyer, 2008","""A Cross-Category Model of Households' Incidence and Quantity Decisions"", Marketing Science, Issue 2, 225-235, with N. Rakesh, V. Padmanabhan, 2008","""An Econometric Model of Location and Pricing in the Gasoline Market"", Journal of Marketing Research, Issue 4, 622-635, with T. Chan, V. Padmanabhan, 2007","""Bounded Rationality in Pricing Under State Dependent Demand: Do First Look Ahead?"", Journal of Marketing Research, Issue 3, 434-449, with H. Che, K. Sudhir, 2007","""Optimal Pricing Strategies for an Automotive Aftermarket Retailer"", Marketing Research, Issue 4, 588-604, with M. Mantrala, R. Kaul, S. Gopalakrishna, A. Stam, 2006"
